{
  "schema_version": "ghostlight.participant_appraisal.v0",
  "appraisal_id": "lucent-hostage-feed-v0.turn-20.appraisal.sol_vant",
  "review_status": "accepted_as_draft",
  "scene_loop_id": "lucent-hostage-feed-v0",
  "turn_id": "turn-20",
  "participant_agent_id": "sol_vant",
  "event_ref": "examples/training-loops/lucent-hostage-feed-v0/lucent-hostage-feed-v0.turn-20.event.json",
  "current_character_state_ref": "examples/training-loops/lucent-hostage-feed-v0/lucent-hostage-feed-v0.turn-19.mutation.json",
  "participant_local_context": [
    "Participant receives the camera-mediated event, live feed overlays, and room-visible motion described by the event record."
  ],
  "observable_event_summary": "Mara Quell action: Mara keeps both hands low and open, standing angled away from the gate so neither Juno nor Sol has to read her as an advance. Her eyes flick once to the lower-third, then back to the space between them.",
  "known_facts": [
    "EDIT TRAIL HOLD and the custody graphic state are visible on the crisis feed.",
    "Juno's bodily safety and Sol's evidence demand are the active negotiation axis."
  ],
  "active_pressures": [
    "Avoid triggering a violent breach or renewed physical restraint.",
    "Keep feed framing from replacing the observable event with brand-safe narrative."
  ],
  "perceived_relationships": [
    "Trust is conditional and mediated by visible compliance, not private intent.",
    "Each participant may misread the action through role pressure and feed position."
  ],
  "interpretation": "sol_vant can reasonably read the event as a change in the safety/evidence geometry, while remaining unsure how much of the actor's private intent is sincere or strategic.",
  "emotional_appraisal": "Pressure decreases slightly around immediate bodily harm while institutional distrust remains high.",
  "interpretation_label": "ambiguous",
  "confidence_notes": "Moderate confidence: action is visible, but motive and future compliance remain inferred from public behavior.",
  "candidate_implications": {
    "memory": [
      "Remember turn-20 as a visible shift in hostage/evidence leverage."
    ],
    "relationship": [
      "Update perceived reliability of mara_quell from this visible action only."
    ],
    "state": [
      "Carry forward changed physical leverage and feed condition state."
    ],
    "world": [
      "Crisis feed state remains part of the public record."
    ]
  },
  "review": {
    "reviewer": "Codex coordinator",
    "accepted_for_training": true,
    "rationale": "Appraisal uses participant-local visibility, current state refs, and explicit uncertainty instead of actor private intent.",
    "failure_labels": []
  }
}
