{
  "schema_version": "ghostlight.participant_appraisal.v0",
  "appraisal_id": "lucent-hostage-feed-v0.turn-10.appraisal.sol_vant",
  "review_status": "accepted_as_draft",
  "scene_loop_id": "lucent-hostage-feed-v0",
  "turn_id": "turn-10",
  "participant_agent_id": "sol_vant",
  "event_ref": "examples/training-loops/lucent-hostage-feed-v0/lucent-hostage-feed-v0.turn-10.event.json",
  "current_character_state_ref": "examples/training-loops/lucent-hostage-feed-v0/lucent-hostage-feed-v0.turn-09.mutation.json",
  "participant_local_context": [
    "Participant receives the camera-mediated event, live feed overlays, and room-visible motion described by the event record."
  ],
  "observable_event_summary": "Feed Ops Chorus action: The crisis feed does not cut. EDIT TRAIL HOLD remains pinned above Sol's highlighted arbitration clip, with the laughing sticker and timestamp left intact. A plain white overlay opens beside the atrium view: HOW THIS ROW WAS MADE. Sponsor-risk panels are reduced to small red tabs, still visible but no longer swallowing the frame. Mara Quell's audio is ducked under a synthesized feed-ops voice labeled SOURCE PROCESS NOTE.",
  "known_facts": [
    "EDIT TRAIL HOLD and the custody graphic state are visible on the crisis feed.",
    "Juno's bodily safety and Sol's evidence demand are the active negotiation axis."
  ],
  "active_pressures": [
    "Avoid triggering a violent breach or renewed physical restraint.",
    "Keep feed framing from replacing the observable event with brand-safe narrative."
  ],
  "perceived_relationships": [
    "Trust is conditional and mediated by visible compliance, not private intent.",
    "Each participant may misread the action through role pressure and feed position."
  ],
  "interpretation": "sol_vant can reasonably read the event as a change in the safety/evidence geometry, while remaining unsure how much of the actor's private intent is sincere or strategic.",
  "emotional_appraisal": "Pressure decreases slightly around immediate bodily harm while institutional distrust remains high.",
  "interpretation_label": "ambiguous",
  "confidence_notes": "Moderate confidence: action is visible, but motive and future compliance remain inferred from public behavior.",
  "candidate_implications": {
    "memory": [
      "Remember turn-10 as a visible shift in hostage/evidence leverage."
    ],
    "relationship": [
      "Update perceived reliability of feed_ops_chorus from this visible action only."
    ],
    "state": [
      "Carry forward changed physical leverage and feed condition state."
    ],
    "world": [
      "Crisis feed state remains part of the public record."
    ]
  },
  "review": {
    "reviewer": "Codex coordinator",
    "accepted_for_training": true,
    "rationale": "Appraisal uses participant-local visibility, current state refs, and explicit uncertainty instead of actor private intent.",
    "failure_labels": []
  }
}
